[
  {
    "id": "kworb:blinding lights@after hours",
    "rank": 1,
    "title": "Blinding Lights",
    "album": "After Hours",
    "role": "lead",
    "streams_total": 4285000000,
    "streams_daily": 5120000,
    "last_update_kworb": "2025-09-30T00:00:00Z",
    "spotify_data_date": "2025-09-29"
  },
  {
    "id": "kworb:starboy@starboy",
    "rank": 2,
    "title": "Starboy",
    "album": "Starboy",
    "role": "lead",
    "streams_total": 3920000000,
    "streams_daily": 4350000,
    "last_update_kworb": "2025-09-30T00:00:00Z",
    "spotify_data_date": "2025-09-29"
  },
  {
    "id": "kworb:die for you@starboy",
    "rank": 3,
    "title": "Die For You",
    "album": "Starboy",
    "role": "lead",
    "streams_total": 2815000000,
    "streams_daily": 3200000,
    "last_update_kworb": "2025-09-30T00:00:00Z",
    "spotify_data_date": "2025-09-29"
  },
  {
    "id": "kworb:save your tears@after hours",
    "rank": 4,
    "title": "Save Your Tears",
    "album": "After Hours",
    "role": "lead",
    "streams_total": 2980000000,
    "streams_daily": 0,
    "last_update_kworb": "2025-09-30T00:00:00Z",
    "spotify_data_date": "2025-09-29"
  },
  {
    "id": "kworb:one of the girls@the idol episode 4",
    "rank": 5,
    "title": "One Of The Girls",
    "album": "The Idol Episode 4",
    "role": "feat",
    "streams_total": 1540000000,
    "streams_daily": 2100000,
    "last_update_kworb": "2025-09-30T00:00:00Z",
    "spotify_data_date": "2025-09-29"
  }
]
